Sentence,grade
The food there is so good that even to order out the wait is incredible.,2
The bartender on my most recent visit was so incredibly rude that I will never go back.,0
"Their sushi, Kamikaze and other Rolls are fresh and well presented.",2
"For authentic Thai food, look no further than Toons.",2
"The highlight of the night was the mayonaisse for my side of fries I received from one of the food runners, which is not good considering the bill was nearly $100.",0
"I choose to go with one of the special, the braised lamb shank in red wine, which was excellent.",2
"If anyones has doubt of not knowing enough about wines,please check their wine list.",1
"The only concern i have is with the slighly all-business waitstaff who order and throw the food down, rushing you out.",0
Have the iced tea.,2
"Small servings for main entree, i had salmon (wasnt impressed) girlfriend had chicken, it was good.",0
you can actually get 2 salads worth if u take it home and add it to some lettuce!,0
The ambience is very romantic and definitely a good place to bring a date.,2
"It is far more popular as a bar than as a restaurant, with only a few tables and the waiter being the bartender, but we greatly enjoyed the unobtrusive atmosphere.",2
"The food is very good for it's price, better than most fried dumplings I've had.",2
There are much better places in NY with better prices.,0
Obv caviar is top of the line but the rest of the menu is so diverse it gives you a chance to taste so manydifferent varietys.,2
I ate here a week ago and found most dishes average at best and too expensive.,0
"Still, try it once, since if you end up loving the food, it could be one of your best dining experiences.",1
I've waited over one hour for food.,1
"Other guests enjoyed pizza, santa fe chopped salad and fish and chips.",2
The ambience is very calm and quiet.,2
"Both times I was extremely dissappointed by the service, which was boarderline rude.",0
"not only does make the best pizza in NY , maybe anywhere.",2
The spicy Tuna roll is huge and probably the best that I've had at this price range.,2
Price and quality of fish alone will keep us from making a return visit.,0
Our waiter and all of the people helping him were attentive and genuine.,2
The place is a BISTRO which means: simple dishes and wine served efficiently in a bustling atmosphere.,2
This is one of the best comfort food places in the city.,2
"Overall, the ingredients and technique are there and I am encouraged enough to return at lunch or dinner to see whether the boldness of the flavour palette improves.",2
I had a huge pastrami sandwich on a roll.,2
"Though you will undoubtedly be seated at a table with what seems like barely enough room (no matter what the size of your party), the warm atomosphere is worth the cramped quarters- you'll have fun and forgot about the tight spot you're in.",0
The fish was not fresh and the rice tasted old and stale.,0
"Considering their price of $6.25 for lunch special, the dish was ridiculously small.",0
This is the pinnacle of Indian Fast Food (all fast foods in my opinion).,2
"Besides, when you have bad service, that's less money you have to tip.",0
The wine list is also really nice.,2
"Service was devine, oysters where a sensual as they come, and the price can't be beat!!!",2
"Compared to Ess-a, Tal offers a less doughy bagel!",0
Ballato's is consistently delicious authentic italian food.,2
"The service was attentive, yet discreet.",2
For those prices and the dressed up atmosphere you expect more and should get more.,0
They offer the same menu but have creative drinks that are loaded with alcohol and cheeky names -- but they do cost you.,1
We went to eat at the Jekyll and Hyde restaurant on Friday night and really enjoyed the fun atmosphere and good food.,2
The food was pretty tradional but it was hot and good with large portions.,2
"Unless you are eating in the Pizzeria side of this place, and are not in a rush, this place is a bad idea.",0
You have to increase the service a lot.,0
Ambiance is barely romantic but management tries.,0
"I must warn the reader that the portions sizes are very small (especially the appetizers), so if you plan to eat until you are full and do not intend to order the chef's special tasting menu, prepare to order and pay for an appetizer (1 dish for each person because the portions are not for sharing), a main entree, and the cold udon at the end of the meal.",0
They were very abrupt with me when I called and actually claimed the food was late because they were out of rice.,0
"After we got our sashimi order, I could not believe how small the portions were!",1
"After the main course came, we didn't see our waiter for at least 40 MINUTES!",1
Nothing better than buying a snapple for $3.25 too.,2
"When family came in he gave them apps to test their palets, and then ordered for them.",1
"Service is extraordinary, yet not overbearing, and the decor brings a taste of trendy SoHo into Queens.",2
"The dosas are skimpy, unattractive and drip with grease, and personally I'd drink popcorn topping before I'd eat another one of these.",0
The service was excellent and the food was delicious.,2
If I wanted to deal with a crappy scene and annoying customers I'd go out in Manhattan.,0
"After a seafood craving, i checked citysearch and chose to go to Fish based on a previous review and the citysearch info.",1
Right off the major deegan you get ladies from all over the city.,2
Until you realize that their five minutes is meaningless and your wait may be anywhere from two to twenty minutes it may be frustrating.,0
"Thalia is a beautiful restaurant with beautiful people serving you, but the food doesn't quite match up.",2
The fillings may be unconventional but the dosa batter is definitely authentic and the combinations very tasty.,1
"This is the perfect spot for meeting friends, having lunch, dinner, pre-theatre or after-theatre drinks!",2
"The mussaman curry that I ordered was as thin as water and aside from the poorly fried tofu that I ordered in it, they graciously provided me with ONE piece of poorly cooked potato.",0
Had a late night dinner on a Saturday night.,1
A restaurant that doesn't try to do anything except serve great food with great service in a pleasant atmosphere.,2
Their sake martini is wonderful.,2
"Well, this place is so Ghetto its not even funny.",0
Once they ran out of Gnochi and made it for me from scratch!,1
We would like to thank Marcelo and Grace for a wonderful dining experience!!!,2
"Found service above average, but that could be because we were 13 of us.",2
"Bagels are ok, but be sure not to make any special requests!",1
fine dining restaurant quality.,2
Overall a disappointing experience for that price category.,0
"I've had the lunch buffet at Chennai a couple of times, when I have been in the neighborhood.",1
The food was exceptional.,2
A Thai restaurant out of rice during dinner?,1
The portions are small but being that the food was so good makes up for that.,0
(and I have eaten my share) Which impresses me for having such a large amount of people to serve.,2
"Sure, the setting is nice.",2
"The service is friendly, if not the most prompt in the world, the food is great, and the prices, while not cheap, won't put your wallet out of commission.",2
"Had 1 appetizer, 2 entrees and 2 cokes and the bill was ~$55.00, not including tip.",1
Best drumsticks over rice and sour spicy soup in town!,2
Slightly above average wines start at $70+ with only one selection listed at $30+.,0
Their whitefish salad is excellent--all whitefish with a little mayo.,2
"And it all comes at a very reasonable price (congee, noodles, and rice dishes are no more than $3-6 each).",2
"The chicken parm was edible but had canned tomato sauce and boxed pasta and the chicken with portobello mushrooms consisted of dry, inedible chicken with terrible sauce.",0
I recommend this place to everyone who asks me where to go for a good meal.,2
The waitresses are nice--also you can just get counter service sit.,2
The only friendly staff member was the guy at the bar.,2
"You can certainly find restaurants that offer a superior fine dining experience, but for superb food at reasonable prices, La Villa can't be beat.",2
Won't or Can't is not in the service directory.,2
I cannot imagine a friendlier staff working in a restaurant.,2
I do suggest to ask to be seated upstairs if you are looking to be a little cozy.,2
"The red curry is weak and tasteless, the pad thai is stuck together and lumpy, the rice is often overcooked, and the seafood is pretty sketchy.",0
The wine list is extensive and can easily hike up an otherwise reasonably priced meal.,2
"Saul is pretty good, but definitely not great.",1
"I would recommend Roxy's for that, but not for their food.",0
We always get a sampling of appetizers and share.,1
"Overall I was impressed and will return, it's a great QPR (Quality to Price Ratio).",2
"It is nearly impossible to get a table, so if you ever have the chance to go here for dinner, DO NOT pass it up.",0
Their pad penang is delicious and everything else is fantastic.,2
"The puke green walls leave a lot to be desired, but the food is very good.",2
"The flavors are very fresh and pretty inobtrusive, nothing flashy.",2
"I like Cafe Noir dont get me wrong, it is jsut that the people who work there are evil and incompetent!!",0
The hanger steak was like rubber and the tuna was flavorless not to mention it tasted like it had just been thawed.,0
"Our son loves pizza and we have a certified Neapolitan pizzaria in our home city (Seattle), we liked this nearly as much - and the differences were more about personal preference than any reflection on either restaurant.",2
big and soft as well as good lunch food.,2
"No food snobs allowed, this place is for people who appreciate good food.",1
I liked the food at this quasi-thai restaurant.,2
By far the best salad I have had in a fast food restaurant.,2
"As for the bar, this is another bad idea.",0
"Their bagels are fine, but they are a little overcooked, and not really a 'special' bagel experience.",1
"Unlike HH up the block, this place actually gives you hearty and hot bagels this town is known for.",2
The barebecued salmon is elegantly spiced and not at all dry.,2
"Same owner as the guy who owns Typhoon, which is just down the street on St. Marks and 1st Ave.",1
What generous portions!,2
The workers there also absolutely load the bagel with cream cheese (gets a little messy).,1
The wine the service was very good too.,2
"So, the menu is written in chalk above your head and it all sounds delicious.",1
The highly spiced chai tea was great too.,2
"I have been there many times, and food is good and consistent.",2
"Seriously, this is the best all you can eat in town- As everyone says, the Spicy Tuna hand rolls are the best- have 4 of these, and you've broken even.",2
"While Sapphire is certainly not lacking in ambiance, and probably has the best decor of any Indian restaurant I have been to in New York City, the food was not what I had hoped for.",0
I would highly recommend this place to anyone looking for a casual atmosphere that whisks you away to the left bank of the river Seine.,2
The meat dishes were only so-so.,1
"His wife Tanya, the hostess, completes the comforting atmosphere by being delightfully warm and gracious.",2
"The menu consisted of standard brassiere food, better then places like Balthazar etc.",2
"I have been a longtime fan of Holy Basil in the East Village, and while I do believe their food has slightly slipped in quality, I have been hesitant to be disloyal.",0
"But the best part about LS is the late night atmosphere, delightfully free of the BTs.",2
We even had a visit from the Manager who wanted to make sure we were enjoying ourselves.,2
The staff there is very attentive and down to earth.,2
"You don't go to Mizu for excellent service, you go for the large amounts of food, the amiable atmosphere, and the hole-in-the-wall feeling of the place.",0
"The service is always bad though, don't expect much of anything from your server, and I would not recommend bringing a date here either.",0
Monday nights are a bargain at the $28 prix fix - this includes a three course meal plus *three* glasses of wine paired with each course.,2
It took them 15 minutes to put water in our glasses.,1
The service is descent even when this small place is packed.,2
This is the best sushi in new york city - hands down.,2
I have eaten a lot of pizza here.,1
Great value for the quality ingredients.,2
"The Thali was small, thoroughly unremarkable, and $14.95.",0
The sushi is also great!,2
From the complimentary chef app of a delicate butternut squash ravioli in a delicious truffle sauce to an amazing buttery and tender langostine entree to a dessert that I can't remember because of the fabulous Cakebread Cabernet we were drinking -- the whole evening was amazing.,2
Truly the mark of an attentive waiter.,2
"The food here is rather good, but only if you like to wait for it.",2
I got an excellent piece of cheesecake and we had several other nice pastries.,2
"The staff is very kind and well trained, they're fast, they are always prompt to jump behind the bar and fix drinks, they know details of every item in the menu and make excelent recomendations.",2
The makhani was OK --the korma was bland.,1
The food is inventive but still keeps traditional indian flavoring.,2
"The decor in this place is very diner-ish and the kind of place you expect in the East Village - not romantic, just simple, small and sparse.",2
This is a cute place and could be good but they need to get their act together.,2
The lox is always fresh too.,2
Service was very friendly.,2
So all I'm trying to say is this restaurant is by far the best thai food restaurant I've ever been to.,2
Food was OK - fish was cooked well.,1
We actually left hungry and went across the street to Wo Hop at 15 Mott street for some good chinese food.,2
The duck confit is always amazing and the foie gras terrine with figs was out of this world.,2
"The whole set up is truly unprofessional and I wish Cafe Noir would get some good staff, because despite the current one this is a great place.",0
The staff offers impeccable service.,2
We ended our great experience by having Gulab Jamun (dessert) recommended by the waiter.,2
"This place doesn't compare with Mamoun's in terms of price, freshness, value, and consisent quality, but that's just my opinion.",0
"The place is sleek, modern and playfull and i will return again frequently.",2
"I have known about this secret for the last 13 years, Emilio(the Godfather) has continued to serve food and wine for the gods at mortal prices.",2
The brioche and lollies as party favors is a cute and sweet touch to a most memorable meal.,2
"After being told that our party of three would be seated in 10 minutes and watching other parties (multiples of 2 and higher) seated for 40 minutes, the three of us were squished into a small 2-person table.",0
And the bill was outragous.,0
"The service was attentive, yet unimposing, the food was far better than many notorious restaurants in Midtown and the wine list is extensive and well priced.",2
"Kind, attentive wait staff.",2
Salads were fantastic.,2
The owners and employees are friendly and their pizza is fantastic.,2
"The food is yummy, especially their cooked-to-perfection mussels in spicy tomato sauce and their shoestring crispy fries.",2
The food is authentic Italian - delicious!,2
skip dessert.,0
I complete the total bagel experience by having it lightly toasted.,2
It was like the servers forgot that they actually worked there and instead wanted to hang out and be cool.,0
The service is good and ambience is good for a date or group outing.,2
A great way to make some money is to buy a case of snapple from Costco and sell it right outside for only $2.50.,1
It's all about the food !!,2
Fast service.,2
"The staff is excellent, specjal: that girl behind the bar, european chic.",2
"stick with the chicken, beef, and lamb dishes.",2
"The service was bad, the food took to forever to come, we sat on the upper level.",0
"We a menu that rearely changes,e xcept for one or two specials, the quality and care they put in thier food in evident.",2
This restaurant is a wonderful place to go many times and it is reasonably priced.,2
"Bottom line: B+ for the food, F for the service.",2
The only thing the waiters don't do for you is wipe your chin when you leave.,2
"Stick to dimsum, not super overpriced noodles.",1
The service is fine and they allow you to enjoy the view.,2
"We, there were four of us, arrived at noon - the place was empty - and the staff acted like we were imposing on them and they were very rude.",0
delicious simple food in nice outdoor atmosphere.,2
The only fallback on this restaurant is the prices.,0
I've been to Naples 45 for dinner twice.,1
The hot and sour soup was unbearably hot and tasted of only pepper and nothing else.,0
Try sushimi cucumber roll.,2
The food is delicious.,2
Their wines by the glass are a great accompaniment and you can eat like a king with wine for under $30.,2
This place has the the correct ambience and an excellent staff to make you feel like a guest and a friend at the same time.,2
Yeah Shanghai is also great but not quite as good -- they use the same amount of salt but without sweetness to balance out.,0
"believe us, we've been eating sushi for over 15 yrs.",1
The atmosphere is much better than Sripraphai (more modern and sleek).,2
"The food is outstanding and the service is quick, friendly and very professional.",2
"The bagels always warm, soft on the inside, crispy on the outside and enormous in size.",2
"I had a late dinner at Lucky Stike, a great name for a joint if ever I saw one.",1
Service is fast and friendly.,2
from an English speaking staff.,1
And they have these home made potato chips at the bar that are the most delicious things in the world!,2
My husband and I enjoyed each of the 6 taste size portions and left completely full.,2
"I went here with a friend on a whim, we went someplace else first and couldn't get a table.",0
"We all ate pasta entre'es, which were great.",2
The steak was excellent and one of the best I have had (I tasted the butter intitally but in no way did it overwhelm the flavor of the meat).,2
The food was boring and expensive.,0
"The ambience is pretty and nice for conversation, so a casual lunch here would probably be best.",2
Terrific menu full of unique rolls and special dishes.,2
The service is ok but could be better.,0
"We love the food, drinks, and atmosphere!",2
I was here a few weeks back and we had the worst customer service experience at a restaurant ever.,0
"Went on a 3 day oyster binge, with Fish bringing up the closing, and I am so glad this was the place it O trip ended, because it was so great!",2
"Took my mom for Mother's Day, and the maitre d' was pretty rude.",0
My husband and I have been there a couple of times and each time we sat at the sushi bar (chef Yoshi) and ordered everything ala carte.,1
"The vibe is very relaxed and cozy, service was great and the food was excellent!",2
"If the weather is nice, try to snag an outside table.",2
"If you are looking for a good quality, cheap eats - this is the place.",2
The service was friendly and the atmosphere was casual.,2
When I lived upstate for a while I would buy freeze the bagels and they would still be better than any else.,1
"I recommend their Pad See Ew, Pork Chops or Tofu plates.",2
Never in my life did I think that I could be satisfied both in taste and in quantity for $3.00 in NYC.,2
"this is the best secret place in midtown', I heard that from the bartender, after having brilliant food ( try steak with portobello mushrooms) and drinks on the bar last Tuesday.",1
The service was excellent - friendly and attentive.,2
"The main course had an average portion, and was decent overall.",2
20 minutes for our reservation but it gave us time to have a few cocktails and enjoy our surroundings and each other.,0
"Waitstaff is great, very attentive.",2
The dinner menu is diverse and top-notch as well.,2
IT IS WHAT MODERN CUISINE IS ALL ABOUT.,2
"I don't like Indian food too much and this was delicious, however you want to factor that into the equation.",2
"at taj, vegetarians can rejoice-all the dishes are manna from heaven.",2
I won't go back unless someone else is footing the bill.,0
"We live in New Jersey and whenever we go into New York City we buy bagels to eat hot and then to freeze (they told me that if I call in the order, they'd bring it out to the car so I wouldn't have to look for parking).",1
Jimmy's is hands down the hottest night spot in the Bronx.,2
And I would have to agree with the masses in terms of service - delivery is their Achilles' heel.,0
"The $300 bill was a bit steep, but the experience was great.",0
"Nice ambiance, nice little bar, good bartender, Francois, and good service.",2
"The calamari comes with an incredible sauce, and the duck noodles are yummy as well.",2
I would definitely go back -- if only for some of those exotic martinis on the blackboard.,2
Simple comfort food and what hot and lage portions.,2
"Stay away from the two specialty rolls on the menu, though- too much avocado and rice will fill you up right quick.",0
We didn't get drink refills and she didn't even offer us the option of dessert.,0
The bagels are also reasonably priced for NYC.,2
"If you can handle that, it's a great place for a business dinner, fun with friends or simply a table for 2.",2
Decor leaves something to be desired.,0
"Also, specify if you like your food spicy- its rather bland if you don't.",1
"Our waiter was fine, the place looks nice in that not-trying-too-hard way, but at those prices, a little more should be expected of your food.",2
Coming from Boston this place is like Emma's Pizza in Kendall Square in Cambridge (although they have more funky toppings!),2
"When my husband and go there, we spend $60.00 (have LOBSTER TAILS UMMMMM need I say more) I can't say any more, it a place you'll never forget If you never go, you'll miss A Meal of your life time",2
"in an effort to increase turnover, the restaurant offers no desserts beyond the complimentary espresso cup filled with chocolate mousse.",2
"I've been to this restaurant more than a dozen times and when I'm craving for Pho, Lemon grass chicken or Beef Cube on rice, this is the place to go.",2
"Oh yes, and if you are a fan of Indian oldies film stars, there are plenty of portraits of Indian actors and actresses in classic black white that adorn the walls, some of which, I would love to know where they obtained.",2
"The food is spectacular, from the appitizers to the main course, and then of course the desserts, (WOW) you'll need no more.",2
My fish was delicious in an incredible curry sauce.,2
If you are in search of the most authentic NYC deli experience look no further than the famous and historic Katz's Deli down on the Lower East Side.,2
"Even upon delivery, their juicy pork buns are quite good . .",2
"Average to good Thai food, but terrible delivery.",2
The space is nice but when we order our drink we were in for a surprise.,2
The entire place and the treatment we received felt as a conveyor belt.,0
Joe's Pizza used to have the best slice until this pizzeria opened up.,2
And they provided a delicious dessert on the house!,2
"They are still living in the dark ages and do not have an answering machine, so if you want to make a reservation you are limited.",0
"The food is amazing, rich pastas and fresh doughy pizza.",2
"Food was very good, but not what I would consider out of this world.",2
I had Lobster Bisque it has 2 oz. of Maine Lobster in it.,2
"Try the Pad Thai, it's fabulous and their prices are so cheap!",2
Food is great and inexpensive.,2
The price very reasonable.,2
"Dessert - can't be missed, so save room!!!",2
"It can be a little confusing as to where one goes to order, but once the food is ordered, you are in for a treat.",2
Ingredients are organic which is a real plus for me.,2
It was so bad I actually refused to pay for my food.,0
I recommend this spot to anyone who enjoys  fine cuisine at reasonable prices.,2
"The staff was very attentive, the ambience lovely, and the food superb.",2
"I love when restaurants think using fancy expensive ingrediants makes the food fine cuisine, even with no idea how to use them.",2
THe Pizza and wine were excellent-the service too--but what really MADE this place was the backyard dining area.,2
"The waiters are sweet, the food is tasty and the bill is never too large.",2
"The service was superb, they treat you like family.",2
"We all had the tasting menu and unlike some of the other reviews, I felt there was more than enough food.",2
"It only took about five or so minutes to get an empty table, but standing up wasn't too bad.",2
"The menu may be small, but everything on it is delicious.",0
They had scrapped the bottom of the vessel in which they make the rice -RESULT - WE HAD LARGE CHUNKS OF BURNT RICE IN OUR SERVING BOWL.,0
"Warm, comfortable surroundings, nice appointments (witness the etched glass and brickwork separating the dining rooms).",2
We ran a little late for the reservation but it wasn't a problem to get our table immediately.,1
We arrived on time for our reservation and seated promptly.The,2
"I would definitely go back for a very special occasion, but not for regular fine dining.",1
"The well mannered, pleasant staff that Tony has in his employ.",2
The flavors robust and subtle.,2
"All I can say is $2 pints during happy hour and the some of the cheapest oysters you'll find in the city, though the quality is some of the best.",2
