Sentence,grade
Food is way overpriced and portions are fucking small.,0
I recently tried Caballero's and I have been back every week since!,2
"for 40 bucks a head, i really expect better food.",0
The food came out at a good pace.,2
"I ate there twice on my last visit, and especially enjoyed the salmon salad.",2
I won't be back.,0
We could not believe how dirty the oysters were!,0
This place deserves no stars.,0
I would not recommend this place.,0
"In fact I'm going to round up to 4 stars, just because she was so awesome.",2
"To my disbelief, each dish qualified as the worst version of these foods I have ever tasted.",0
"Bad day or not, I have a very low tolerance for rude customer service people, it is your job to be nice and polite, wash dishes otherwise!!",0
the potatoes were great and so was the biscuit.,2
I probably would not go here again.,0
So flavorful and has just the perfect amount of heat.,2
The price is reasonable and the service is great.,2
"The Wife hated her meal (coconut shrimp), and our friends really did not enjoy their meals, either.",0
My fella got the huevos rancheros and they didn't look too appealing.,0
"Went in for happy hour, great list of wines.",2
Some may say this buffet is pricey but I think you get what you pay for and this place you are getting quite a lot!,2
I probably won't be coming back here.,0
Worst food/service I've had in a while.,0
"This place is pretty good, nice little vibe in the restaurant.",2
Talk about great customer service of course we will be back.,2
"Hot dishes are not hot, cold dishes are close to room temp.I watched staff prepare food with BARE HANDS, no gloves.Everything is deep fried in oil.",0
I love their fries and their beans.,2
Always a pleasure dealing with him.,2
"They have a plethora of salads and sandwiches, and everything I've tried gets my seal of approval.",2
This place is awesome if you want something light and healthy during the summer.,2
"For sushi on the Strip, this is the place to go.",2
"The service was great, even the manager came and helped with our table.",2
The feel of the dining room was more college cooking course than high class dining and the service was slow at best.,0
"I started this review with two stars, but I'm editing it to give it only one.",0
this is the worst sushi i have ever eat besides Costco's.,0
"All in all an excellent restaurant highlighted by great service, a unique menu, and a beautiful setting.",2
My boyfriend and i sat at the bar and had a completely delightful experience.,2
Weird vibe from owners.,0
There was hardly any meat.,0
I've had better bagels from the grocery store.,0
Go To Place for Gyros.,2
"I love the owner/chef, his one authentic Japanese cool dude!",2
"Now the burgers aren't as good, the pizza which used to be amazing is doughy and flavorless.",0
I found a six inch long piece of wire in my salsa.,0
"The service was terrible, food was mediocre.",0
We definately enjoyed ourselves.,2
I ordered Albondigas soup - which was just warm - and tasted like tomato soup with frozen meatballs.,0
"On three different occasions I asked for well done or medium well, and all three times I got the bloodiest piece of meat on my plate.",0
I had about two bites and refused to eat anymore.,0
The service was extremely slow.,0
"After 20 minutes wait, I got a table.",0
Seriously killer hot chai latte.,2
"No allergy warnings on the menu, and the waitress had absolutely no clue as to which meals did or did not contain peanuts.",0
My boyfriend tried the Mediterranean Chicken Salad and fell in love.,2
Their rotating beers on tap is also a highlight of this place.,2
Pricing is a bit of a concern at Mellow Mushroom.,0
Worst Thai ever.,0
If you stay in Vegas you must get breakfast here at least once.,2
I want to first say our server was great and we had perfect service.,2
The pizza selections are good.,2
"I had strawberry tea, which was good.",2
Highly unprofessional and rude to a loyal patron!,0
"Overall, a great experience.",2
Spend your money elsewhere.,0
Their regular toasted bread was equally satisfying with the occasional pats of butter... Mmmm...!,2
The Buffet at Bellagio was far from what I anticipated.,0
"And the drinks are WEAK, people!",0
"Also, I feel like the chips are bought, not made in house.",0
After the disappointing dinner we went elsewhere for dessert.,0
The chips and sals a here is amazing!!!!!!!!!!!!!!!!!!!,2
We won't be returning.,0
This is my new fav Vegas buffet spot.,2
I seriously cannot believe that the owner has so many unexperienced employees that all are running around like chickens with their heads cut off.,0
"Very, very sad.",0
"i felt insulted and disrespected, how could you talk and judge another human being like that?",0
"How can you call yourself a steakhouse if you can't properly cook a steak, I don't understand!",0
I'm not impressed with the concept or the food.,0
The only thing I wasn't too crazy about was their guacamole as I don't like it pur矇ed.,0
"There is really nothing for me at postinos, hope your experience is better",0
I got food poisoning here at the buffet.,0
They brought a fresh batch of fries and I was thinking yay something warm but no!,0
"What SHOULD have been a hilarious, yummy Christmas Eve dinner to remember was the biggest fail of the entire trip for us.",0
"Needless to say, I won't be going back anytime soon.",0
This place is disgusting!,0
"Every time I eat here, I see caring teamwork to a professional degree.",2
The RI style calamari was a joke.,0
"However, there was so much garlic in the fondue, it was barely edible.",0
"I could barely stomach the meal, but didn't complain because it was a business lunch.",0
"It was so bad, I had lost the heart to finish it.",0
It also took her forever to bring us the check when we asked for it.,0
We aren't ones to make a scene at restaurants but I just don't get it...definitely lost the love after this one!,0
Disappointing experience.,0
"The food is about on par with Denny's, which is to say, not good at all.",0
"If you want to wait for mediocre food and downright terrible service, then this is the place for you.",0
WAAAAAAyyyyyyyyyy over rated is all I am saying.,0
We won't be going back.,0
The place was fairly clean but the food simply wasn't worth it.,0
This place lacked style!!,0
"The sangria was about half of a glass wine full and was $12, ridiculous.",0
Don't bother coming here.,0
"The meat was pretty dry, I had the sliced brisket and pulled pork.",0
"The building itself seems pretty neat, the bathroom is pretty trippy, but I wouldn't eat here again.",0
It was equally awful.,0
Probably not in a hurry to go back.,0
very slow at seating even with reservation.,0
Not good by any stretch of the imagination.,0
The cashew cream sauce was bland and the vegetables were undercooked.,0
"The chipolte ranch dipping sause was tasteless, seemed thin and watered down with no heat.",0
"It was a bit too sweet, not really spicy enough, and lacked flavor.",0
I was VERY disappointed!!,0
This place is horrible and way overpriced.,0
"Maybe it's just their Vegetarian fare, but I've been twice and I thought it was average at best.",0
It wasn't busy at all and now we know why.,0
The tables outside are also dirty a lot of the time and the workers are not always friendly and helpful with the menu.,0
"The ambiance here did not feel like a buffet setting, but more of a douchey indoor garden for tea and biscuits.",0
Con: spotty service.,0
"The fries were not hot, and neither was my burger.",0
But then they came back cold.,0
"Then our food came out, disappointment ensued.",0
The real disappointment was our waiter.,0
My husband said she was very rude... did not even apologize for the bad food or anything.,0
The only reason to eat here would be to fill up before a night of binge drinking just to get some carbs in your stomach.,0
"Insults, profound deuchebaggery, and had to go outside for a smoke break while serving just to solidify it.",0
If someone orders two tacos don't' you think it may be part of customer service to ask if it is combo or ala cart?,0
She was quite disappointed although some blame needs to be placed at her door.,0
After all the rave reviews I couldn't wait to eat here......what a disappointment!,0
Del Taco is pretty nasty and should be avoided if possible.,0
It's NOT hard to make a decent hamburger.,0
But I don't like it.,0
Hell no will I go back,0
We've have gotten a much better service from the pizza place next door than the services we received from this restaurant.,0
"I don't know what the big deal is about this place, but I won't be back ""ya'all"".",0
I immediately said I wanted to talk to the manager but I did not want to talk to the guy who was doing shots of fireball behind the bar.,0
The ambiance isn't much better.,0
"Unfortunately, it only set us up for disapppointment with our entrees.",0
The food wasn't good.,0
"Your servers suck, wait, correction, our server Heimer sucked.",0
What happened next was pretty....off putting.,0
"too bad cause I know it's family owned, I really wanted to like this place.",0
Overpriced for what you are getting.,0
I vomited in the bathroom mid lunch.,0
"I kept looking at the time and it had soon become 35 minutes, yet still no food.",0
"I have been to very few places to eat that under no circumstances would I ever return to, and this tops the list.",0
We started with the tuna sashimi which was brownish in color and obviously wasn't fresh.,0
Food was below average.,0
It sure does beat the nachos at the movies but I would expect a little bit more coming from a restaurant.,0
"All in all, Ha Long Bay was a bit of a flop.",0
The problem I have is that they charge $11.99 for a sandwich that is no bigger than a Subway sub (which offers better and more amount of vegetables).,0
Shrimp- When I unwrapped it (I live only 1/2 a mile from Brushfire) it was literally ice cold.,0
"It lacked flavor, seemed undercooked, and dry.",0
It really is impressive that the place hasn't closed down.,0
I would avoid this place if you are staying in the Mirage.,0
The refried beans that came with my meal were dried out and crusty and the food was bland.,0
Spend your money and time some place else.,0
A lady at the table next to us found a live green caterpillar In her salad.,0
the presentation of the food was awful.,0
I can't tell you how disappointed I was.,0
I think food should have flavor and texture and both were lacking.,0
Appetite instantly gone.,0
Overall I was not impressed and would not go back.,0
"The whole experience was underwhelming, and I think we'll just go to Ninja Sushi next time.",0
"Then, as if I hadn't wasted enough of my life there, they poured salt in the wound by drawing out the time it took to bring the check.",0
But the staff was so horrible to us.,0
"To be completely fair, the only redeeming factor was the food, which was above average, but couldn't make up for all the other deficiencies of Teodora.",2
"The food is uniformly exceptional, with a very capable kitchen which will proudly whip up whatever you feel like eating, whether it's on the menu or not.",2
"Not only was the food outstanding, but the little 'perks' were great.",2
Our agreed favorite is the orrechiete with sausage and chicken (usually the waiters are kind enough to split the dish in half so you get to sample both meats).,2
"The Bagels have an outstanding taste with a terrific texture, both chewy yet not gummy.",2
Nevertheless the food itself is pretty good.,2
"They did not have mayonnaise, forgot our toast, left out ingredients (ie cheese in an omelet), below hot temperatures and the bacon was so over cooked it crumbled on the plate when you touched it.",0
"It took half an hour to get our check, which was perfect since we could sit, have drinks and talk!",1
The design and atmosphere is just as good.,2
He has visited Thailand and is quite expert on the cuisine.,2
The pizza is the best if you like thin crusted pizza.,2
"All the money went into the interior decoration, none of it went to the chefs.",2
The seats are uncomfortable if you are sitting against the wall on wooden benches.,0
"I asked for seltzer with lime, no ice.",1
"Don't go alone---even two people isn't enough for the whole experience, with pickles and a selection of meats and seafoods.",2
My suggestion is to eat family style because you'll want to try the other dishes.,1
"Best of all is the warm vibe, the owner is super friendly and service is fast.",2
Faan's got a great concept but a little rough on the delivery.,0
"From the incredible food, to the warm atmosphere, to the friendly service, this downtown neighborhood spot doesn't miss a beat.",2
"Great food at REASONABLE prices, makes for an evening that can't be beat!",2
this little place has a cute interior decor and affordable city prices.,2
Two words: Free wine.,2
The price is reasonable although the service is poor.,2
"The quantity is also very good, you will come out satisfied.",2
"I stumbled upon this second floor walk-up two Fridays ago when I was with two friends in town from L.A. Being serious sushi lovers, we sat at the sushi bar to be closer to the action.",1
The fried rice is amazing here.,2
"Three courses - choices include excellent mussels, puff pastry goat cheese and salad with a delicious dressing, and a hanger steak au poivre that is out of this world.",2
it's a perfect place to have a amanzing indian food.,2
The place is so cool and the service is prompt and curtious.,2
At the end you're left with a mild broth with noodles that you can slurp out of a cup.,2
I just wonder how you can have such a delicious meal for such little money.,2
The wine list is excellent.,2
"Ive been to many Thai restaurants in Manhattan before, and Toons is by far the best Thai food Ive had (except for my mom's of course).",2
They wouldnt even let me finish my glass of wine before offering another.,1
"Whem asked, we had to ask more detailed questions so that we knew what the specials were.",1
This is a consistently great place to dine for lunch or dinner.,1
"Nice atmosphere, the service was very pleasant and the desert was good.",2
After really enjoying ourselves at the bar we sat down at a table and had dinner.,2
"Fabulous service, fantastic food, and a chilled out atmosphere and environment.",2
Try the lasagnette appetizer.,2
I liked the beer selection!,2
"Great food, good size menu, great service and an unpretensious setting.",2
Go here for a romantic dinner but not for an all out wow dining experience.,2
I grew up eating Dosa and have yet to find a place in NY to satisfy my taste buds.,1
Wine list selection is good and wine-by-the-glass was generously filled to the top.,2
"With the great variety on the menu , I eat here often and never get bored .",2
The menu is very limited - i think we counted 4 or 5 entrees.,0
The menu is limited but almost all of the dishes are excellent.,0
Not too crazy about their sake martini.,0
"Great bagels, spreads and a good place to hang out in.",2
One thing I liked about this place is that I never felt rushed or pressured to give up my table ot incoming guests.,1
"Unfortunately, the food is outstanding, but everything else about this restaurant is the pits.",2
We always have a delicious meal and always leave feeling satisfied.,2
"Dip the ingredients in with your chopsticks, swirl them around, and eat.",1
First went here to enjoy their garden terrace.,2
The pizza was pretty good and huge.,2
"The cuisine from what I've gathered is authentic Taiwanese, though its very different from what I've been accustomed to in Taipei.",1
I almost hesititate to write a review because the atmosphere was so great and I would hate for it too become to crowded.,2
They are often crowded on the weekends but they are efficient and accurate with their service.,2
All my co-workers were amazed at how small the dish was.,0
"The atmosphere is unheralded, the service impecible, and the food magnificant.",2
"We ordered the special, grilled branzino, that was so infused with bone, it was difficult to eat.",0
"The wait staff is friendly, and the food has gotten better and better!",2
"It may be a bit packed on weekends, but the vibe is good and it is the best French food you will find in the area.",2
Right off the L in Brooklyn this is a nice cozy place with good pizza.,2
Le Pere Pinard has a $15 pre-theater menu that is outstanding.,2
I also ordered for delivery and the restaurant forgot half the order.,0
Our server checked on us maybe twice during the entire meal.,0
The strong scents coming from the left and right of me negatively affected my taste buds.,0
We had the lobster sandwich and it was FANTASTIC.,2
"Had we been stalling I could understand where they were coming from, but we had been there less than an hour and they hadn't even brought us a check yet!",0
"Though the Spider Roll may look like a challenge to eat, with soft shell crab hanging out of the roll, it is well worth the price you pay for them.",2
Deep Fried Skewers are good and still rare to find in NYC.,2
"I have tried to make reservations, but both times, the hostess didn't have my name.",1
I also recommend the rice dishes or the different varieties of congee (rice porridge).,2
Their tuna tartar appetizer is to die for.,2
"An oasis of refinement:  Food, though somewhat uneven, often reaches the pinnacles of new American fine cuisine - chef's passion (and kitchen's precise execution) is most evident in the fish dishes and soups.",2
"If you love wine and cheese and delicious french fare, you'll love Artisanal!",2
I love Indian food and consider myself to be quite an expert on it.,2
Some baby pizzas get their wish.,1
Overall A oh ya even though there is waiting it is deff worth it,0
The lava cake dessert was incredible and I recommend it.,2
VT is what baby pizzas hope to be when they grow up.,1
"From the terrible service, to the bland food, not to mention the unaccommodating managers, the overall experience was horrible.",0
Lahore is a great place to duck into late-night when you need some really tasty food on the cheap -- you'll likely have trouble finishing the amount of food you get for FOUR DOLLARS.,2
The last time I went we were seated at a table in a corridor next to the kitchen.,0
good selection of wines ranging from affordable to high end.,2
"Nice restaurant overall, with classic upscale Italian decor.",2
Not impressed with the food.,0
The entire dining experience was wonderful!,2
The wine selection (by the glass and bottle) is wonderful and I always recommend that friends make a reservation if they're going to be in town.,2
Service is highly refined: our seating was delayed 35 minutes past our reservation and the maitre d' apologized and regularly kept us apprised of progress.,2
"Order the panang duck, it's fantastic.",2
"Food is usually very good, though ocasionally I wondered about freshmess of raw vegatables in side orders.",0
"Other than the crappy service from two individuals, it's great.",0
They have authentic Indian at amazin prices.,2
Ambiance- relaxed and stylish.,2
"Luckily we saved room for the BBQ Salmon, Sea Bass and Crispy Duck.",2
"Yes, they use fancy ingredients, but even fancy ingredients don't make for good pizza unless someone knows how to get the crust right.",2
and yes Dal Bukhara is so dam good and so are all the kababs.,2
I look forward to eating here again,2
I've been coming here as a child and always come back for the taste.,2
Tuk Tuk is one of those comfortable neighborhood joints where you know you will always have a good meal at a fair price.,2
"A glass of Leaping Lizard, a glass of prosecco, and the mussels had everything happy.",2
"Food was average and creme brulee was awful - the sugar was charred, not caramelized and smelled of kerosene.",1
The food always tastes fresh and served promptly.,2
The pizza here is delicious.,2
"Pizza and garlic knots are great as well, I order from them quite often and the delivery is always super quick!",2
"For great chinese food nearby, you have Wu Liang Ye and Grand Sichuan just a block away.",2
But who says Murray's is anything about service.,1
"This place is really trendi but they have forgotten about the most important part of a  restaurant, the food.",0
Hats off to the chef.,2
"Service could be improved but overall this is a place that understands the importance of little things (the heavy, black, antique-seeming teapot, for one) in the restaurant experience.",0
"The pizza is delicious - they use fresh mozzarella instead of the cheap, frozen, shredded cheese common to most pizzaria's.",2
Its an excellent place to relax and the food is one of the best in the city of New York.,2
"service is friendly, and never had a problem walking in and getting a table.",2
The atmosphere was crowded but it was a great bistro-type vibe.,2
"First off, the waitress was completely unattentive the 2 times we saw her(odd in a restaurant with 6 tables) and got our order wrong.",0
The food was bland oily.,0
"What is even better, is that the prices are very affordable as well, and the food is really good.",2
The fish is fresh but the variety of fish is nothing out of ordinary.,2
"Our favorite meal is a pesto pizza, the house salad, and a good bottle of wine.",2
"And Kruno, the beverage manager is the best bartender I have yet to come across.",2
"Ambiance and music funky, which I enjoy.",2
"The food, drinks and service are clearly among the best in the city.",2
I went there in late afternoon for some bite size food and refleshment with my date.,1
"I understand the area and folks you need not come here for the romantic, alluring ambiance or the five star service featuring a sommlier and a complicated maze of captain and back waiters - you come for the authentic foods, the tastes, the experiance.",2
"Last time I went here, the waitress didn't come back after taking our order.",0
Try the tandoori salmon!,2
"Eating in, the atmosphere saves it, but at your desk, it's a very disappointing experience.",2
"Granted the space is smaller than most, it is the best service you will find in even the largest of restaurants.",0
I love the atmorphere @ peep!,2
The service was attentive and her suggestions of menu items was right on the mark.,2
The other night we had the $30 three course meal and everything was delicious - if I could of licked the plate clean I would of.,2
"Even after getting pushed out by the no-class Famous Ray's, Sal has risen again to carry on his father's uncle's legacies with a smile, true love for his community, and let's not forget the Outstanding Pizza!",2
"The environment is romantic, but the food is horrible, the service is pathetic, and gabriella lies about everything she could.",2
"We had crawfish boiled and despite making a mess, it was a ton of fun and quite tasty as well.",2
I had very high expectations for this place and made a reservation a couple of months in advance for a special occasion.,1
What came to our table was burned beyond recognition and stringy.,1
I had the Pad Thai and the noodles were sticky.,0
"So I've never actually been to M proper, but I've had it delivered a few times.",1
"Among all of the new 5th avenue restaurants, this offers by far one of the best values for your money.",2
"Frankly, when you compare what you can have here for lunch, versus McDs or so many other sandwich shops in the city, there is no comparison.",2
The hostess is rude to the point of being offensive.,0
"If you're craving for Haru's great food, especially the House Roll, but can't stand the wait building outisde, head across the street to their Sake Bar!",2
"A narrow corridor leads to a tiny space where there are three tiny white tiled counters, a great deal of mess (stacks of bottles, cans) and a small counter holding 12-14 entrees.",0
The food is great.,2
Succulent steaks cooked precisely to your desired 'doneness' accompanied by salads and sides that don't look like leafy road kill.,2
"Lunch came with pickels and slaw, no extra charge.",2
Decent wine at reasonable prices.,2
All conveniently delivered right to the door.,2
even the wine by the glass was good.,2
would have rather tried terrace in the sky or water club for that price,0
This dish is my favorite and I always get it when I go there and never get tired of it.,2
"I also ordered the Change Mojito, which was out of this world.",2
Okay service.,1
The only thing more wonderful than the food (which is exceptional) is the service.,2
"The food was just awful, ATROCIOUS actually.",0
The soup for the udon was soy sauce and water.,0
"The anti-pasta was excellent, especially the calamari, as were the filling pasta mains.",2
The waitress suggested glasses of wine that went very well with the food.,2
"They might be all business at the counter when you give your order, but their food says I love you.",2
"We are very particular about sushi and were both please with every choice which included: ceviche mix (special), crab dumplings, assorted sashimi, sushi and rolls, two types of sake, and the banana tempura.",2
Try their plain pizza with fresh garlic or eggplant.,2
"Ok, so the servers wander around a little clueless, but there's more than enough servers for the crowd they get -- it's fine, you just have to make a small effort to get their attention.",0
Good luck getting a table.,0
The service is awful.,0
"The takeout menu says to keep an eye out for an expanded menu offering more italian dishes, I can't wait!",2
"I am not the most experienced person when it comes to Thai food, but my friend who took me there is.",1
Regardless of whether there are two people or two hundred people ahead of you the hostess will take your name and tell you Five minutes.,2
The pizza is good though.,2
bottles of wine are cheap and good.,2
