Sentence,grade
Wow... Loved this place.,2
Crust is not good.,0
Not tasty and the texture was just nasty.,0
Stopped by during the late May bank holiday off Rick Steve recommendation and loved it.,2
The selection on the menu was great and so were the prices.,2
Now I am getting angry and I want my damn pho.,0
Honeslty it didn't taste THAT fresh.),0
The potatoes were like rubber and you could tell they had been made up ahead of time being kept under a warmer.,0
The fries were great too.,2
A great touch.,2
Service was very prompt.,2
Would not go back.,0
The cashier had no care what so ever on what I had to say it still ended up being wayyy overpriced.,0
"I tried the Cape Cod ravoli, chicken, with cranberry...mmmm!",2
I was disgusted because I was pretty sure that was human hair.,0
I was shocked because no signs indicate cash only.,0
Highly recommended.,2
Waitress was a little slow in service.,0
"This place is not worth your time, let alone Vegas.",0
did not like at all.,0
The Burrittos Blah!,0
"The food, amazing.",2
Service is also cute.,2
I could care less... The interior is just beautiful.,2
So they performed.,2
That's right....the red velvet cake.....ohhh this stuff is so good.,2
"This hole in the wall has great Mexican street tacos, and friendly staff.",2
"Took an hour to get our food only 4 tables in restaurant my food was Luke warm, Our sever was running around like he was totally overwhelmed.",0
The worst was the salmon sashimi.,0
"Also there are combos like a burger, fries, and beer for 23 which is a decent deal.",2
This was like the final blow!,0
I found this place by accident and I could not be happier.,2
"seems like a good quick place to grab a bite of some familiar pub food, but do yourself a favor and look elsewhere.",0
"Overall, I like this place a lot.",2
The only redeeming quality of the restaurant was that it was very inexpensive.,2
Ample portions and good prices.,2
"Poor service, the waiter made me feel like I was stupid every time he came to the table.",0
My first visit to Hiro was a delight!,2
Service sucks.,0
The shrimp tender and moist.,2
There is not a deal good enough that would drag me into that establishment again.,0
Hard to judge whether these sides were good because we were grossed out by the melted styrofoam and didn't want to eat it for fear of getting sick.,0
"On a positive note, our server was very attentive and provided great service.",2
"Frozen pucks of disgust, with some of the worst people behind the register.",0
The only thing I did like was the prime rib and dessert section.,2
It's too bad the food is so damn generic.,0
"The burger is good beef, cooked just right.",2
If you want a sandwich just go to any Firehouse!!!!!,2
"My side Greek salad with the Greek dressing was so tasty, and the pita and hummus was very refreshing.",2
We ordered the duck rare and it was pink and tender on the inside with a nice char on the outside.,2
He came running after us when he realized my husband had left his sunglasses on the table.,2
Their chow mein is so good!,2
"They have horrible attitudes towards customers, and talk down to each one when customers don't enjoy their food.",0
The portion was huge!,2
"Loved it...friendly servers, great food, wonderful and imaginative menu.",2
The Heart Attack Grill in downtown Vegas is an absolutely flat-lined excuse for a restaurant.,0
Not much seafood and like 5 strings of pasta at the bottom.,0
"The salad had just the right amount of sauce to not over power the scallop, which was perfectly cooked.",2
"The ripped banana was not only ripped, but petrified and tasteless.",0
At least think to refill my water before I struggle to wave you over for 10 minutes.,0
This place receives stars for their APPETIZERS!!!,2
The cocktails are all handmade and delicious.,2
We'd definitely go back here again.,2
We are so glad we found this place.,2
"Great food and service, huge portions and they give a military discount.",2
Always a great time at Dos Gringos!,2
Update.....went back for a second time and it was still just as amazing,2
We got the food and apparently they have never heard of salt and the batter on the fish was chewy.,0
A great way to finish a great.,2
"The deal included 5 tastings and 2 drinks, and Jeff went above and beyond what we expected.",2
The service was meh.,0
"It took over 30 min to get their milkshake, which was nothing more than chocolate milk.",0
"I guess I should have known that this place would suck, because it is inside of the Excalibur, but I didn't use my common sense.",0
The scallop dish is quite appalling for value as well.,0
2 times - Very Bad Customer Service !,0
The sweet potato fries were very good and seasoned well.,2
Today is the second time I've been to their lunch buffet and it was pretty good.,2
There is so much good food in Vegas that I feel cheated for wasting an eating opportunity by going to Rice and Company.,0
Coming here is like experiencing an underwhelming relationship where both parties can't wait for the other person to ask to break up.,0
walked in and the place smelled like an old grease trap and only 2 others there eating.,0
The turkey and roast beef were bland.,0
This place has it!,2
The pan cakes everyone are raving about taste like a sugary disaster tailored to the palate of a six year old.,0
I love the Pho and the spring rolls oh so yummy you have to try.,2
The poor batter to meat ratio made the chicken tenders very unsatisfying.,0
All I have to say is the food was amazing!!!,2
Omelets are to die for!,2
Everything was fresh and delicious!,2
"In summary, this was a largely disappointing dining experience.",0
"It's like a really sexy party in your mouth, where you're outrageously flirting with the hottest person at the party.",2
"Never been to Hard Rock Casino before, WILL NEVER EVER STEP FORWARD IN IT AGAIN!",0
Best breakfast buffet!!!,2
say bye bye to your tip lady!,0
We'll never go again.,0
Will be back again!,2
Food arrived quickly!,2
It was not good.,0
"On the up side, their cafe serves really good food.",2
"Our server was fantastic and when he found out the wife loves roasted garlic and bone marrow, he added extra to our meal and another marrow to go!",2
"The only good thing was our waiter, he was very helpful and kept the bloddy mary's coming.",2
"Best Buffet in town, for the price you cannot beat it.",2
"I LOVED their mussels cooked in this wine reduction, the duck was tender, and their potato dishes were delicious.",2
This is one of the better buffets that I have been to.,2
So we went to Tigerlilly and had a fantastic afternoon!,2
"The food was delicious, our bartender was attentive and personable AND we got a great deal!",2
The ambience is wonderful and there is music playing.,2
Will go back next trip out.,2
Sooooo good!!,2
"REAL sushi lovers, let's be honest - Yama is not that good.",0
"At least 40min passed in between us ordering and the food arriving, and it wasn't that busy.",0
This is a really fantastic Thai restaurant which is definitely worth a visit.,2
"Nice, spicy and tender.",2
Good prices.,2
Check it out.,2
It was pretty gross!,0
I've had better atmosphere.,0
Kind of hard to mess up a steak but they did.,0
"Although I very much liked the look and sound of this place, the actual experience was a bit disappointing.",0
I just don't know how this place managed to served the blandest food I have ever eaten when they are preparing Indian cuisine.,0
"Worst service to boot, but that is the least of their worries.",0
Service was fine and the waitress was friendly.,2
"The guys all had steaks, and our steak loving son who has had steak at the best and worst places said it was the best steak he's ever eaten.",2
"We thought you'd have to venture further away to get good sushi, but this place really hit the spot that night.",2
"Host staff were, for lack of a better word, BITCHES!",0
Bland... Not a liking this place for a number of reasons and I don't want to waste time on bad reviewing.. I'll leave it at that...,0
"Phenomenal food, service and ambiance.",2
I wouldn't return.,0
"Definitely worth venturing off the strip for the pork belly, will return next time I'm in Vegas.",2
This place is way too overpriced for mediocre food.,0
Penne vodka excellent!,2
"They have a good selection of food including a massive meatloaf sandwich, a crispy chicken wrap, a delish tuna melt and some tasty burgers.",2
The management is rude.,0
"Delicious NYC bagels, good selections of cream cheese, real Lox with capers even.",2
"Great Subway, in fact it's so good when you come here every other Subway will not meet your expectations.",2
I had a seriously solid breakfast here.,2
This is one of the best bars with food in Vegas.,2
"He was extremely rude and really, there are so many other restaurants I would love to dine at during a weekend in Vegas.",0
My drink was never empty and he made some really great menu suggestions.,2
Don't do it!!!!,0
The waiter wasn't helpful or friendly and rarely checked on us.,0
My husband and I ate lunch here and were very disappointed with the food and service.,0
And the red curry had so much bamboo shoots and wasn't very tasty to me.,0
Nice blanket of moz over top but i feel like this was done to cover up the subpar food.,2
The bathrooms are clean and the place itself is well decorated.,2
"The menu is always changing, food quality is going down & service is extremely slow.",0
"The service was a little slow , considering that were served by 3 people servers so the food was coming in a slow pace.",0
I give it 2 thumbs down,0
We watched our waiter pay a lot more attention to other tables and ignore us.,0
My fianc矇 and I came in the middle of the day and we were greeted and seated right away.,2
This is a great restaurant at the Mandalay Bay.,2
We waited for forty five minutes in vain.,0
Crostini that came with the salad was stale.,0
Some highlights : Great quality nigiri here!,2
the staff is friendly and the joint is always clean.,2
this was a different cut than the piece the other day but still wonderful and tender s well as well flavored.,2
I ordered the Voodoo pasta and it was the first time I'd had really excellent pasta since going gluten free several years ago.,2
this place is good.,2
"Unfortunately, we must have hit the bakery on leftover day because everything we ordered was STALE.",0
I came back today since they relocated and still not impressed.,0
I was seated immediately.,2
"Their menu is diverse, and reasonably priced.",2
Avoid at all cost!,0
Restaurant is always full but never a wait.,2
DELICIOUS!!,2
This place is hands-down one of the best places to eat in the Phoenix metro area.,2
So don't go there if you are looking for good food...,0
I've never been treated so bad.,0
Bacon is hella salty.,2
"We also ordered the spinach and avocado salad, the ingredients were sad and the dressing literally had zero taste.",0
"This really is how Vegas fine dining used to be, right down to the menus handed to the ladies that have no prices listed.",2
The waitresses are very friendly.,2
"Lordy, the Khao Soi is a dish that is not to be missed for curry lovers!",2
Everything on the menu is terrific and we were also thrilled that they made amazing accommodations for our vegetarian daughter.,2
"Perhaps I caught them on an off night judging by the other reviews, but I'm not inspired to go back.",0
The service here leaves a lot to be desired.,0
"The atmosphere is modern and hip, while maintaining a touch of coziness.",2
"Not a weekly haunt, but definitely a place to come back to every once in a while.",2
We literally sat there for 20 minutes with no one asking to take our order.,0
"The burger had absolutely no flavor - the meat itself was totally bland, the burger was overcooked and there was no charcoal flavor.",0
I also decided not to send it back because our waitress looked like she was on the verge of having a heart attack.,0
I dressed up to be treated so rudely!,0
It was probably dirt.,0
"Love this place, hits the spot when I want something healthy but not lacking in quantity or flavor.",2
I ordered the Lemon raspberry ice cocktail which was also incredible.,2
"The food sucked, which we expected but it sucked more than we could have imagined.",0
Interesting decor.,2
What I really like there is the crepe station.,2
"Also were served hot bread and butter, and home made potato chips with bacon bits on top....very original and very good.",2
you can watch them preparing the delicious food!),2
Both of the egg rolls were fantastic.,2
"When my order arrived, one of the gyros was missing.",0
"I had a salad with the wings, and some ice cream for dessert and left feeling quite satisfied.",2
I'm not really sure how Joey's was voted best hot dog in the Valley by readers of Phoenix Magazine.,0
The best place to go for a tasty bowl of Pho!,2
The live music on Fridays totally blows.,0
I've never been more insulted or felt disrespected.,0
Very friendly staff.,2
It is worth the drive.,2
"I had heard good things about this place, but it exceeding every hope I could have dreamed of.",2
Food was great and so was the serivce!,2
The warm beer didn't help.,0
Great brunch spot.,2
Service is friendly and inviting.,2
Very good lunch spot.,2
I've lived here since 1979 and this was the first (and last) time I've stepped foot into this place.,0
The WORST EXPERIENCE EVER.,0
Must have been an off night at this place.,0
"The sides are delish - mixed mushrooms, yukon gold puree, white corn - beateous.",2
"If that bug never showed up I would have given a 4 for sure, but on the other side of the wall where this bug was climbing was the kitchen.",0
"For about 10 minutes, we we're waiting for her salad when we realized that it wasn't coming any time soon.",0
My friend loved the salmon tartar.,2
Won't go back.,0
Extremely Tasty!,2
Waitress was good though!,2
Soggy and not good.,0
The Jamaican mojitos are delicious.,2
Which are small and not worth the price.,0
"The shower area is outside so you can only rinse, not take a full shower, unless you don't mind being nude for everyone to see!",0
The service was a bit lacking.,0
"Lobster Bisque, Bussell Sprouts, Risotto, Filet ALL needed salt and pepper..and of course there is none at the tables.",0
Hopefully this bodes for them going out of business and someone who can cook can come in.,0
"It was either too cold, not enough flavor or just bad.",0
I loved the bacon wrapped dates.,2
This is an unbelievable BARGAIN!,2
The folks at Otto always make us feel so welcome and special.,2
"As for the ""mains,"" also uninspired.",0
This is the place where I first had pho and it was amazing!!,2
This wonderful experience made this place a must-stop whenever we are in town again.,2
"If the food isn't bad enough for you, then enjoy dealing with the world's worst/annoying drunk people.",0
Very very fun chef.,2
"Ordered a double cheeseburger & got a single patty that was falling apart (picture uploaded) Yeah, still sucks.",0
Great place to have a couple drinks and watch any and all sporting events as the walls are covered with TV's.,2
"If it were possible to give them zero stars, they'd have it.",0
"The descriptions said ""yum yum sauce"" and another said ""eel sauce"", yet another said ""spicy mayo""...well NONE of the rolls had sauces on them.",0
"I'd say that would be the hardest decision... Honestly, all of M's dishes taste how they are supposed to taste (amazing).",2
If she had not rolled the eyes we may have stayed... Not sure if we will go back and try it again.,0
"Everyone is very attentive, providing excellent customer service.",2
Horrible - don't waste your time and money.,0
Now this dish was quite flavourful.,2
By this time our side of the restaurant was almost empty so there was no excuse.,0
"(It wasn't busy either) Also, the building was FREEZING cold.",0
"like the other reviewer said ""you couldn't pay me to eat at this place again.""",0
-Drinks took close to 30 minutes to come out at one point.,0
"Seriously flavorful delights, folks.",2
Much better than the other AYCE sushi place I went to in Vegas.,2
The lighting is just dark enough to set the mood.,2
Based on the sub-par service I received and no effort to show their gratitude for my business I won't be going back.,0
Owner's are really great people.!,2
There is nothing privileged about working/eating there.,0
The Greek dressing was very creamy and flavorful.,2
"Overall, I don't think that I would take my parents to this place again because they made most of the similar complaints that I silently felt too.",0
Now the pizza itself was good the peanut sauce was very tasty.,2
We had 7 at our table and the service was pretty fast.,2
Fantastic service here.,2
I as well would've given godfathers zero stars if possible.,0
They know how to make them here.,2
very tough and very short on flavor!,0
I hope this place sticks around.,2
"I have been in more than a few bars in Vegas, and do not ever recall being charged for tap water.",0
The restaurant atmosphere was exquisite.,2
"Good service, very clean, and inexpensive, to boot!",2
The seafood was fresh and generous in portion.,2
"Plus, it's only 8 bucks.",2
"The service was not up to par, either.",0
"Thus far, have only visited twice and the food was absolutely delicious each time.",2
Just as good as when I had it more than a year ago!,2
"For a self proclaimed coffee cafe, I was wildly disappointed.",0
The Veggitarian platter is out of this world!,2
You cant go wrong with any of the food here.,2
You can't beat that.,2
"Stopped by this place while in Madison for the Ironman, very friendly, kind staff.",2
The chefs were friendly and did a good job.,2
"I've had better, not only from dedicated boba tea spots, but even from Jenni Pho.",0
I liked the patio and the service was outstanding.,2
The goat taco didn't skimp on the meat and wow what FLAVOR!,2
I think not again,0
I had the mac salad and it was pretty bland so I will not be getting that again.,0
I went to Bachi Burger on a friend's recommendation and was not disappointed.,2
Service stinks here!,0
I waited and waited.,0
"This place is not quality sushi, it is not a quality restaurant.",0
I would definitely recommend the wings as well as the pizza.,2
Great Pizza and Salads!,2
Things that went wrong: - They burned the saganaki.,0
We waited an hour for what was a breakfast I could have done 100 times better at home.,0
This place is amazing!,2
"I hate to disagree with my fellow Yelpers, but my husband and I were so disappointed with this place.",0
Waited 2 hours & never got either of our pizzas as many other around us who came in later did!,0
Just don't know why they were so slow.,0
"The staff is great, the food is delish, and they have an incredible beer selection.",2
"I live in the neighborhood so I am disappointed I won't be back here, because it is a convenient location.",0
I didn't know pulled pork could be soooo delicious.,2
"You get incredibly fresh fish, prepared with care.",2
Before I go in to why I gave a 1 star rating please know that this was my third time eating at Bachi burger before writing a review.,0
I love the fact that everything on their menu is worth it.,2
Never again will I be dining at this place!,0
The food was excellent and service was very good.,2
Good beer & drink selection and good food selection.,2
Please stay away from the shrimp stir fried noodles.,0
The potato chip order was sad... I could probably count how many chips were in that box and it was probably around 12.,0
Food was really boring.,0
Good Service-check!,2
This greedy corporation will NEVER see another dime from me!,0
"Will never, ever go back.",0
"As much as I'd like to go back, I can't get passed the atrocious service and will never return.",0
"In the summer, you can dine in a charming outdoor patio - so very delightful.",2
I did not expect this to be so good!,2
Fantastic food!,2
She ordered a toasted English muffin that came out untoasted.,0
The food was very good.,2
Never going back.,0
"Great food for the price, which is very high quality and house made.",2
The bus boy on the other hand was so rude.,0
"By this point, my friends and I had basically figured out this place was a joke and didn't mind making it publicly and loudly known.",0
"Back to good BBQ, lighter fare, reasonable pricing and tell the public they are back to the old ways.",2
"And considering the two of us left there very full and happy for about $20, you just can't go wrong.",2
All the bread is made in-house!,2
The only downside is the service.,0
"Also, the fries are without a doubt the worst fries I've ever had.",0
Service was exceptional and food was a good as all the reviews.,2
"A couple of months later, I returned and had an amazing meal.",2
Favorite place in town for shawarrrrrrma!!!!!!,2
The black eyed peas and sweet potatoes... UNREAL!,2
You won't be disappointed.,2
"They could serve it with just the vinaigrette and it may make for a better overall dish, but it was still very good.",2
"I go to far too many places and I've never seen any restaurant that serves a 1 egg breakfast, especially for $4.00.",0
When my mom and I got home she immediately got sick and she only had a few bites of salad.,0
The servers are not pleasant to deal with and they don't always honor Pizza Hut coupons.,0
"Both of them were truly unbelievably good, and I am so glad we went back.",2
"We had fantastic service, and were pleased by the atmosphere.",2
Everything was gross.,0
I love this place.,2
Great service and food.,2
First - the bathrooms at this location were dirty- Seat covers were not replenished & just plain yucky!!!,0
"The burger... I got the ""Gold Standard"" a $17 burger and was kind of disappointed.",0
"OMG, the food was delicioso!",2
There is nothing authentic about this place.,0
the spaghetti is nothing special whatsoever.,0
"Of all the dishes, the salmon was the best, but all were great.",2
The vegetables are so fresh and the sauce feels like authentic Thai.,2
It's worth driving up from Tucson!,2
The selection was probably the worst I've seen in Vegas.....there was none.,0
Pretty good beer selection too.,2
"This place is like Chipotle, but BETTER.",2
"Classy/warm atmosphere, fun and fresh appetizers, succulent steaks (Baseball steak!!!!!",2
5 stars for the brick oven bread app!,2
"I have eaten here multiple times, and each time the food was delicious.",2
We sat another ten minutes and finally gave up and left.,0
He was terrible!,0
Everyone is treated equally special.,2
It shouldn't take 30 min for pancakes and eggs.,0
It was delicious!!!,2
"On the good side, the staff was genuinely pleasant and enthusiastic - a real treat.",2
"Sadly, Gordon Ramsey's Steak is a place we shall sharply avoid during our next trip to Vegas.",0
As always the evening was wonderful and the food delicious!,2
Best fish I've ever had in my life!,2
(The bathroom is just next door and very nice.),2
The buffet is small and all the food they offered was BLAND.,0
This is an Outstanding little restaurant with some of the Best Food I have ever tasted.,2
Pretty cool I would say.,2
Definitely a turn off for me & i doubt I'll be back unless someone else is buying.,0
Server did a great job handling our large rowdy table.,2
"I find wasting food to be despicable, but this just wasn't food.",0
My wife had the Lobster Bisque soup which was lukewarm.,0
Would come back again if I had a sushi craving while in Vegas.,2
"The staff are great, the ambiance is great.",2
He deserves 5 stars.,2
I left with a stomach ache and felt sick the rest of the day.,0
They dropped more than the ball.,0
"The dining space is tiny, but elegantly decorated and comfortable.",2
"They will customize your order any way you'd like, my usual is Eggplant with Green Bean stir fry, love it!",2
And the beans and rice were mediocre at best.,0
Best tacos in town by far!!,2
I took back my money and got outta there.,0
"In an interesting part of town, this place is amazing.",2
RUDE & INCONSIDERATE MANAGEMENT.,0
"The staff are now not as friendly, the wait times for being served are horrible, no one even says hi for the first 10 minutes.",0
I won't be back.,0
They have great dinners.,2
The service was outshining & I definitely recommend the Halibut.,2
The food was terrible.,0
WILL NEVER EVER GO BACK AND HAVE TOLD MANY PEOPLE WHAT HAD HAPPENED.,0
I don't recommend unless your car breaks down in front of it and you are starving.,0
I will come back here every time I'm in Vegas.,2
This place deserves one star and 90% has to do with the food.,0
This is a disgrace.,0
Def coming back to bowl next time,2
"If you want healthy authentic or ethic food, try this place.",2
I will continue to come here on ladies night andddd date night ... highly recommend this place to anyone who is in the area.,2
"I have been here several times in the past, and the experience has always been great.",2
We walked away stuffed and happy about our first Vegas buffet experience.,2
Service was excellent and prices are pretty reasonable considering this is Vegas and located inside the Crystals shopping mall by Aria.,2
"To summarize... the food was incredible, nay, transcendant... but nothing brings me joy quite like the memory of the pneumatic condiment dispenser.",2
I'm probably one of the few people to ever go to Ians and not like it.,0
Kids pizza is always a hit too with lots of great side dish options for the kiddos!,2
Service is perfect and the family atmosphere is nice to see.,2
Cooked to perfection and the service was impeccable.,2
This one is simply a disappointment.,0
"Overall, I was very disappointed with the quality of food at Bouchon.",0
I don't have to be an accountant to know I'm getting screwed!,0
