Sentence,grade
Consistently good Japanese Tapas.,2
"My goodness, everything from the fish to the rice to the seaweed was absolutely amazing.",2
"The dishes offered were unique, very tasty and fresh from the lamb sausages, sardines with biscuits, large whole shrimp to the amazing pistachio ice cream (the best and freshest I've ever had).",2
The food is reliable and the price is moderate.,2
"While the ambiance and atmosphere were great, the food and service could have been a lot better.",2
The server was really cool and served us our food and drinks with a smile.,2
We were in search of food and stumbled on this block of Indian restaurants on East Sixth Street.,1
"Planet Thailand has always been a hit with me , I go there usually for the sushi, which is great , the thai food is excellent too .",2
"Very excited to hear that short-term Chef Jason Narone has moved on, he truly was a low point of their Sterling track record.",0
I had to share my table with a loud group of kids and the service was rude an unattentive.,0
The sauce on the pizza is sooo good with garlic and fresh tomatoes and they don't skimp.,2
"We recently decided to try this location, and to our delight, they have outdoor seating, perfect since I had my yorkie with me.",2
"My husband had the mesclun, salmon, and ice cream and he enjoyed all 3 courses.",2
We were told that the wait was about twenty minutes and there would be no problem for our 8:00 pm curtain call.,1
The food is usually good but it certainly isn't a relaxing place to go.,2
"Super friendly and knowledgable staff, fabulous bistro fare and a wonderful jazz brunch with great live jazz (the chilaquiles were awesome!",2
The prices were fantastic.,2
"Still, any quibbles about the bill were off-set by the pour-your-own measures of liquers which were courtesey of the house...",2
"The table service could have been a little more attentive but as someone who also works in the service industry, I understood they were busy.",1
"It's not mind-blowing, but to me, thai food never is and never will be.",1
"Food was very good as well, considering that we tried the budget selection (though I wish the pork belly that I ordered was roasted a bit longer, so that fat was more of a melt-in-your-mouth experience).",2
"i've been to sapphire twice and both times the food was fine, if not good.",2
It is kinda nosiy and the tables are close together but it's still a beautiful place to enjoy a nice dinner.,0
I love the fact that the pizza tastes so good and is so cheap.,2
Nicky the Nose at the bar is a treat.,1
"Service was prompt, friendly and great.",2
"I haven't eat a lamb chop as delicious as that,the salads are really nice dressed with lemon and extra virgnin olive oil.",2
The sushi was awful!,0
You can get an excellent meal at most of the many Indian restaurants on nearby Lexington Avenue for the cost of one the dainty dishes here.,2
"The Pastrami sandwich was like buttah and with pickles and an icy cold beer to wash it down, it was a pleasurable experience.",2
The plain pizza was soggy and the creative wild mushroom(third generation-Fornini) pizza we had was drenched with truffle oil in the middle( again making it soggy) and nothingon the rest.,0
"Late nite omelletes are not good here, there is no variety!",0
"After all that, they complained to me about the small tip.",0
It's a great place to pick up a cheap lunch or dinner.,2
"Behind this counter, two men are squeezed in.",0
"Whenever you need a Sushi fix, Mizu will be there with quality fish and great service.",2
"Our waitress was sweet and accomodating, not overbearing.",2
Went there with my wife and we had to wait for a table even though you could see there many that were empty with not reservation sigh on them.,1
I was really disappointed ant wanted to tell everyone not to go eat or even take out food from there.,0
"Despite a slightly limited menu, everything prepared is done to perfection, ultra fresh and a work of food art.",0
The outdoor atmosphere of sitting on the sidewalk watching the world go by 50 feet away on 6th avenue on a cool evening was wonderful.,2
"A large is $20, and toppings are about $3 each.",1
brick oven gallery is My pick for best pizza restaurant anywhere.,2
Add to that great service and great food at a reasonable price and you have yourself the beginning of a great evening.,2
"For many people, this may not seem like Aunthentic Thai food because most places in NYC arent quite authentic.",0
"Growing up in NY, I have eaten my share of bagels.",1
"Oh, don't even let me start with how expensive the bills were!",0
The scallion pancakes and fried dumplings were nothing out of the ordinary.,1
"All the appetizers and salads were fabulous, the steak was mouth watering and the pasta was delicious!!!",2
"Besides having the table we had been promised given to other restaurant patrons twice before we were actually seated, we were served dishes we hadn't ordered three times, received one of our orders 20 minutes after the rest of the table had been served (and that order was undercooked), and charged $45 more than we should have been on our bill.",0
Service is top notch.,2
The food now is inconsistent.,0
"You can also special order any kind of dumpling,etc.",2
I was pretty much full after our fondue appetizer.,1
BE CAREFUL before you request extra spice.,1
The octopus eaters were floored by the Octopus salad.,2
We thought that this place is using too much of MSG cooking in the foods.,0
And the Tom Kha soup was pathetic.,0
I started out with a Bombay beer which was big enough for two.,2
"The decor is vibrant and eye-pleasing with several semi-private boths on the right side of the dining hall, which are great for a date.",2
Service was quick.,2
Drawbacks: service is slow and they don't toast!,0
Went there for an office lunch.,1
The sweet lassi was excellent as was the lamb chettinad and the garlic naan but the rasamalai was forgettable.,2
"We've been following chef Lyle's food around New York for 15 years and while remaining classic, his innovations with bistro fare have made us return and return.",2
The best thing I tasted were the lambchops.,2
The spicy tuna and salmon are the best we've ever had.,2
"Even though its good seafood, the prices are too high.",2
"In addition, the food is very good and the prices are reasonable.",2
"Upon entering, we were greeted by the owners, Steven and Frederick, who went out of their way to be more than gracious hosts.",2
Been going here since it opened have seen the quality value decrease considerably.,0
"Meat dishes now adorn the selections, although there's still a large number of vegetarian-friendly choices.",1
Reasonable prices.,2
they bring service up a notch by offerng complementary amuse bouche to all tables and gave us a small dessert for our celebration.,2
"Try the crunchy tuna, it is to die for.",2
It won't break the bank but I also wouldnt come back for the food.,0
"All in all, this midtown gem instantly became one of my favorite sushi restaurants in the city.",2
It is a lot of fun with live entertainment and all kinds of Disney type special effects.,2
"if you're looking for perfect traditional sushi, go here - if you're looking for interesting combinations, try sushi of gari's (east side).",2
"No refills on fountain drinks, though.",0
Wow over 100 beers to choose from.,2
Be careful of portions - they're HUGE.,2
"The Steak Tartare is a great bet, they fix it for you at the table.",2
My first time there I happened not to like the Crab Croquette apt that i ordered and they were happy to change it for me without making no big deal.,0
Great for large groups and celebrations - our SUPER HAPPY waiter was the entertainment of the evening.,2
Did I mention the wine?,1
"Plus, on Wednesday nights the house wine is unlimited!",2
like saying her bread comes from a special bakery when we have seen her buying it dowtown manhathan.,0
The dim sum servings here are a bit larger than I'm used to.,1
"However, in the summer of 2003, it seems the management has changed and the great big door has been replaced for a glass front ridding itself of the dark romantic getup.",1
We won't go to this place again for a good meal.,0
"Barbecued codfish was gorgeously moist - as if poached - yet the fabulous texture was let down by curiously bland seasoning - a spice rub might have overwhelmed, however herb mix or other sauce would have done much to enhance.",2
"After dinner, take your date to the HUGE dance floor, probably one of the biggest you'll see in NY.",2
Taj Mahal offeres gret value and great food.,2
Has the chef and owner changed???,1
My boyfriend and I recently had an early dinner at Artisanal and was satisfied with our experience.,2
"But don't ever order bacon late at nite (either platter or in sandwiches, for that matter don't from any take out place) as it is from the morning frying turns out hard almost like bacos, hurt my molars.",0
"Outstanding Bagels, but you get what you pay for.",2
"Pizza - the only pizza in NYC that should not have additional toppings - the crust tastes like the best, freshly baked bread!",2
"I found it on a cold night, the perfect spot to warm up.",2
They even have a section in the menu called American Chinese food!,0
"Service was warm and attentive, beef carpaachio was exellent (huge portion) and pasta was fresh and well-prepared.",2
kalbi and nebbiolo do work together.,1
"Best Italian food I ever had (and being Italian, that means alot).",2
I will recommend Scopa to all of my friends for a place to go for wonderful Italian food.,2
Located at the end of a magnificent block.,2
"Looking around, I saw a room full of New Yorkers enjoying a real meal in a real restaurant, not a clubhouse of the fabulous trying to be seen.",2
They don't walk around with the trays of Dim Sum.,1
"Great bar, most gorgeous bartenders you've ever seen (specifically the blond lady).",2
We were planning to get dessert but the waitress basically through the bill at us before we had a chance to order.,1
I really loved the different and inovated touch that's the cheff gives to the food.,2
They came out over cooked and the cheese was almost non existant.,0
"I had a terrific meal, and our server guided us toward a very nice wine in our price range, instead of allowing us to purchase a similarly priced wine that wasn't as good.",2
"The svc can be a bit rude at times, esp if you have big group, but overall the restaurant is a must!",0
"The food is good, especially their more basic dishes, and the drinks are delicious.",2
But the main hit was the whole grilled fish.,2
"I had the tuna tartare with sake, mushroom ravioli with pinot noir, and the chocolate sampler with a dessert wine for $49.",2
On a hot day it was fabulous to stop in and enjoy lunch.,2
The food is delicious and beautifully prepared along with the friendly and personable service.,2
I usually go there later at night when I get off work so I don't have to deal with crowds or lines.,0
Pizza here is consistently good.,2
We had a great tiem watching the shows and characters and ar food was just what we were looking for.,2
"After 2 tries by the waiter to take it away (we hadn't even looked at it yet, we had full beers yet to drink), the manager approached and told us they needed the table for people with reservations.",0
Wouldn't recomend it for dinner!,0
Sauce was watery and the food didn't have much flavor.,0
My husband and I enjoy Sangria.,2
"But after last night, Spice Grill is the only place I'm eating indian cuisine.",2
We both opted for a pasta dish and they were served timely and fresh.,2
"First the wrong bread came out with the appetizer, then when i tried to order a second glass of wine for my main course...",0
"Not sure where the previous reviewer, lonk, dined, but Saul is in a great neighborhood and has great food!",2
"In an area sadly lacking in decent Thai food, this is one of the best spots.",2
Tell them Herky sent you and get a free confused look from the waiter.,0
Make reservations but expect to be delayed 15-20 minutes as the hosting staff was having difficulty seating guests who arrived with a reservation because they probably had a lot of walk ins being so close to Time Square.,0
The food was average or above including some surprising tasty dishes.,2
They don't seem to place an emphasis on specials or fresh ingredients which to me is necessary for good thai.,0
Other apetizers and food,1
The noodle and rices dishes taste great.,2
The food's as good as ever.,2
"The crust is thin, the ingredients are fresh and the staff is friendly.",2
Also a little more expensive than your average bagel place.,1
"the food was undercooked-the sauce watery, and the vegetables raw.",0
And the fried clams had just enough kick to them to make 'em worth eating.,2
The sauces used are also not that exciting.,0
The secret is the lunch menu which offers a complimentary appetizer with every entree ordered.,2
The rice was poor quality and was cooked so badly it was hard.,0
We had champagne and caviar and felt like princesses!,2
The shrimp scampi was excellent and the antipasti were plentiful.,2
"When my dessert came, there was a candle in it - not because anyone asked for one - but because the waiter must have seen me opening my birthday card and gift, and said he knew it was a special occassion of some sort.",1
"I got the $10 10-piece dim sum combo, every bite of which was great.",2
There is also very limited seating and there can be a substantial wait in getting food at peak times.,0
"If it's just a quick martini at the bar (which I recommend Jeffery's) or a mind blowing Roast Chicken, go to Village!",1
"There was a long wait for a table outside, but it was a little too hot in the sun anyway so our insde table was very nice.",1
The prices are wonderfully low.,2
If you like spicy food get the chicken vindaloo.,1
I have never been disappointed but their true strength lays in their amazingly delicious and cheap lunch specials.,2
"So much more than the usual bar food, go there to enjoy the menu while sampling one of their hand-crafted beers.",2
No free drink.,1
This is my first time writing a review for a restaurant because the food and service was excellent.,2
"While they keep the capex to a minimum, they do put some cash into the bagels, because they among the best in the city.",2
The two star chefs left quite some time ago to open their own place.,1
Don't waste money on decor.,1
They also have a back garden open in the summer - cute and French with outdoor seating - what more could you ask for?,2
I have never before eaten 40 pieces of relatively good nigiri.,1
"Given the incredible architecture surrounding it, this place has no character.",2
I'd call it an 'italian dinner'.,1
"While the place is not a hotspot hangout, the drinks are unique and pack a lot of bang for the buck.",2
Have frequented 'ino for several years and the food remains excellent.,2
"Their eggplant is so delicate, sweet tender!",2
"Each bite of food at Kai was indeed delicious, fresh, and elegant.",2
all the food was excellent - considering the quality of food in most moderately priced restaurants is mediocre this was slightly more pricey and well worth it.,2
My friend got the mushroom pizza which tasted better.,2
"I had the cod with paella (spicy and very filling, I'm a big eater and could only eat half) while my boyfriend had the classic fish and chips (again, a big serving - at least 5 pieces of fish and a basketful of fries).",0
"It's a shame that a nice, convenient place like the Pink Pony can be so ruined by lousy service.",2
You should pass on the calamari.,0
"The porcini mushroom pasta special was tasteless, so was the seafood tagliatelle.",0
Try the spicy wontons and the salt pepper shrimps.,2
THE FOOD PORTIONS ARE REALLY LARGE.,2
The fries are yummy.,2
"Friendly and informative staff, very attentive and prompt raw bar service.",2
Best Taiwanese food in NY!,2
This place is a great stop for great food.,2
All the pastas are fantastic and the homemade lasagna is some of the best that I have had in the City.,2
"We laughed when he finally offered us a dessert menu and we left a 10 percent tip, which was generous, I feel.",1
And the prices were way to high for what you get.,0
The staff ignored my friends and I the entire time we were there.,0
"Yet paired with such rude service, would never recommend for anyone interested in carrying any kind of conversation while there.",0
"The in-house lady DJ on Saturday nights has outrageously good taste in music, and moreover, takes requests.",2
"I need at least three rolls to be full, and that's at least $14.00!",1
"Great wine list, reasonably priced.--Sara",2
The hot dogs were cold in the middle and the buns were stale.,0
"While the food was excellent, it wasn't cheap (though not extremely expensive either).",2
Beef noodle soup is good as well.,2
Delivery service is great too.,2
"The food's dazzling flavors overwhelm the palate, truly embracing the beauty of authentic Thai cuisine.",2
I recieved prompt service with a smile.,2
They pray to their Food Gods to make them into a good pizza like VT's.,0
The place was quiet and delightful.,2
The food is a diamond in rough -- the food is delicious and homemade with the perfect balance of herbs and tomatoes.,2
"As much as I like the food there, I can't bring myself to go back.",2
It looked like shredded cheese partly done - still in strips.,0
The prices and ambience are especially great considering it's in the West Village.,2
The soup is pretty good too.,2
It is so easy to get a reservation at a top place in NYC with a week's notice.,2
I have never better enjoyed humble root vegetables or a mushroom consomme - and this chef accomplishes without fats.,2
"If you go to Roth's try to be served by Mike, he is GREAT!!",2
"not the food ,not the ambiance , not the service, I agree with the previous reviews you wait and wait , the wait staff are very rude and when you get in they are looking to get you right out .",1
I always get the Shabu-Shabu dinner and the beef is always fresh.,1
The pizza was delivered cold and the cheese wasn't even fully melted!,0
We were very surprised by how good the food was on our first visit here on a Sunday night.,2
"Nha Trang, while being notorious for utter lack of comfort and decor, horribly slow wait staff and horribly quick meals, is one of the best vietnamese restaurants i've ever been to. the pho is delicious and comes with very fresh vegtables.",0
"On the other hand, if you are not fooled easily, you will find hundreds of restaurants that will give you service and ambiance that is on par with Alain Ducasse, and food that will outshine in presentaion, taste, choice, quality and quantity.",1
I live in the neighborhood and my friends meet me down here not only for the bar scene but also the promise of The Pizza Place at 3am.,2
"If I could rate the people this place would be off the charts - unfortunately - the pizza, sorry - not the best in NYC.",2
The food is amazing!!!!,2
"Having not been home in the last 2 years may skew this reviewer a bit, but the food was tasty and spicy sans the oil that comes floating along at similar venues.",2
"The portions are now very small, the sauces are overly-ambitious usually inedible while the service is still good, the restaurant, due to its popularity, seems frantic.",0
"For the price, you cannot eat this well in Manhattan.",2
"The owner is very friendly and a great guy, go try his pizza, you'll like it!",2
The atmosphere is great!!!,2
"With so many good restaurants on the UWS, I don't need overpriced food, absurdly arrogant wait-staff who don't recognize they work at a glorified diner, clumsy service, and management that doesn't care.",0
"I tend to judge a sushi restaurant by its sea urchin, which was heavenly at sushi rose.",2
The service is a little scatty at times but all is forgiven when the food arrives.,0
"The bruscetta is a bit soggy, but the salads were fresh, included a nice mix of greens (not iceberg) all dishes are served piping hot from the kitchen.",0
"The atmosphere isn't the greatest , but I suppose that's how they keep the prices down .",1
The pickles were great addition.,2
"If your favorite Chinese food is General Tao chicken, then this is NOT your place.",0
You must try the shrimp appetizers.,2
"Not only is the cuisine the best around, the service has always been attentive and charming.",2
"The production is a symphony, alot of fun to experience.The food sublime for the most part.",2
"Waiters tend to forget drinks completely, food portions are so tiny, two people have trouble sharing one entree.",0
The cold appetizer dishes taste like the way I remember them to taste when I was growing up in Taiwan.,2
"The restaurant was packed at first, so we waited at the bar for about 20 minutes before we were seated.",1
"Interesting selection, good wines, service fine, fun decor.",2
Any if you have a reservation you'll wait for max 5 minutes - so have a drink at the bar.,2
"Whether it's the parmesean porcini souffle or the lamb glazed with balsamic vinegar, you will surely be transported to Northern Italy with one bite.",2
The food at this place is 'gourmet' Indian cuisine.,1
But the thing that my wife and I hated was it was so loud and it felt like 'bar' or 'pub'.,0
"While there are plenty of places to go for a good corned beef sandwich, Katz's has a charm about it.",2
"However, looking at the table next to ours, we both sort of wished we had ordered pizza, which looked PERRRRRRRRRFECT.",2
Priced at upper intermediate range.,0
"If you live in new york city, you'll find better food at small restaurants outside of time square and spend half the amount.",0
Try the olive cream cheese or the lox spread on a whole wheat everything bagel.,2
"they didn't disappoint, service from the second i arrived at the door was extremely pleasant and attentive with almost one server per table.",2
I don't know who they think they are but they have no respect for the residents of the neighborhood ever since they opened their cabaret next door and blasts loud music till three in the morning every weekend during the summer.,0
The rice to fish ration was also good--they didn't try to overpack the rice.,2
They used shredded cheese on top!,1
The food is great and they have a good selecion of wines at reasonable prices.,2
"The only positive was the wait staff, which was prompt, knowledgable, and likeable.",2
I couldn't reccommend their Godmother pizza any higher.,2
"I am not a vegetarian but, almost all the dishes were great.",2
I was very impressed by this low-key upper eastsider and their authentically thai cuisine!!!,2
"For the location, the prices are very reasonable.",2
The food is okay and the prices here are mediocre.,1
My friend's food was also the complete opposite of what it's supposed to taste like (aND look like).,0
I ordered the crab cocktail and it was soaked in a lime juice concoction where all you could taste was the lime.,0
I would like to return and try some of the other menu items when I don't have to rush off to a show.,2
"We have been to this place many times, and always have great food, wine, and service.",2
"Hopefully next time, I will save room for dessert.",1
"Not a typical pizza joint, but good for a low key and fairly cheap nice sit down dinner.",2
The corned beef was tender and melted in my mouth.,2
"The best Chicken pad tai, I've ever had.",2
$20 for all you can eat sushi cannot be beaten.,1
"Haru serves very fresh fish, has a trendy, modern ambiance, prime location on Park Avenue South and friendly service.",2
Warm and friendly in the winter and terrific outdoor seating in the warmer months.,2
"Very romantic fires - I've literally spent hours at Lanterna, drinking wine from their extensive wine and enjoying the ambience.",2
We got a little tipsy from the sake but isn't that what Saturday nights with the girlfriends are all about?,1
"I almost wanted to write a bad review, so no one would ever go here and I could have all the dumplings to myself!",2
"Always a nice crowd, but never loud.",2
"My turkey burger was not cooked at all, my friends salmon was completely raw.",0
Decor is minimalist and clean - nothing to distract or commend.,1
"His drinks are very inventive, delicious and classy.",2
"Great food, great prices, great service.",2
This isn't your corner Chinese food takeout.,1
Awsome Pizza especially the Margheritta slice.,2
"This place, however, has a lot less pretension than Joya and the Thai food is still above-average.",2
"Try ordering from the regular menu, then you would not regret!",2
"Told us to sit anywhere, and when we sat he said the table was reserved.",0
"uni from maine vs california, sea vs freshwater eel) to get a good taste comparison.",1
"We started with lox and mussels (the best ive ever had, ever) and had the cod and trout for dinner.",2
"The crispy chicken wasn't for us, though.",0
Food is great.,2
I recommend the meatballs and caprese salad and the beans on toast were a wonderful start to the meal!,2
This place is incredibly tiny.,0
"I didn't complain, I liked the atmosphere so much.",2
In reality (to maximize potential diners) they were still taking phone reservations and reallocating tables of those waiting in the lobby.,1
"The wine is always good, the tapas are always yummy, especially with the warm pita bread.",2
"But when you are seated the waitresses are great, they explain everything on the menu, and the price of the food is really cheap for the service you get.",2
I've been to several places for Dim Sum and this has got to be the WORST.,0
"The freshest, best variety, and the fastest delivery.",2
Go to Volare for 1st class service and terrific food.,2
